{"artifact_type":"context_lock","schema_version":"1.0.0","artifact_id":"HP-WO-0001:context-lock:1","artifact_digest":"sha256:8d393fb8bd0a9d7c2ad049e0d80b11801f0678c5b239b695b4b45affe0eae4dd","project_id":"hive-plan","increment_id":"HP-WO-0001","repository":"KayzenRoot/hive-plan","base_sha":"873240792f4185b8ca96c961d07ce4724fa4912a","sources":[{"source_id":"docs/15-checkpoint.md","source_type":"checkpoint","authority":"CANONICAL","repository":"KayzenRoot/hive-plan","path":"docs/15-checkpoint.md","git_sha":"873240792f4185b8ca96c961d07ce4724fa4912a","fingerprint":"sha256:808ba77b503ec89d41cdee6667918b57590fe01585bb0b8b09fdff7dbab78ca1","critical":true},{"source_id":"adr/ADR-029-v1-application-runtime-and-cockpit-stack.md","source_type":"adr","authority":"CANONICAL","repository":"KayzenRoot/hive-plan","path":"adr/ADR-029-v1-application-runtime-and-cockpit-stack.md","git_sha":"873240792f4185b8ca96c961d07ce4724fa4912a","fingerprint":"sha256:5e4ceed0fb5a924c103ff4165f9103b9a0238dc27c464451cc525b8a4e344614","critical":true},{"source_id":"adr/ADR-030-v1-data-persistence-and-recovery-architecture.md","source_type":"adr","authority":"CANONICAL","repository":"KayzenRoot/hive-plan","path":"adr/ADR-030-v1-data-persistence-and-recovery-architecture.md","git_sha":"873240792f4185b8ca96c961d07ce4724fa4912a","fingerprint":"sha256:21b1bf9c19cc37ae2c7836c8d4f9c2f2d9b6286bdf688d2fd19c11b6440beea7","critical":true},{"source_id":"adr/ADR-031-first-cockpit-vertical-slice-readiness.md","source_type":"adr","authority":"CANONICAL","repository":"KayzenRoot/hive-plan","path":"adr/ADR-031-first-cockpit-vertical-slice-readiness.md","git_sha":"873240792f4185b8ca96c961d07ce4724fa4912a","fingerprint":"sha256:d363fcba33b057f64fee36fcf1926b38a08e81b37ee957ac3ab67ca4483522a6","critical":true},{"source_id":"docs/80-first-vertical-slice-cockpit.md","source_type":"architecture","authority":"CANONICAL","repository":"KayzenRoot/hive-plan","path":"docs/80-first-vertical-slice-cockpit.md","git_sha":"873240792f4185b8ca96c961d07ce4724fa4912a","fingerprint":"sha256:50d342ed336a3585bb9bd68e3d4203bc3bdb2b05d2576d73402ed2e567ff1c32","critical":true},{"source_id":"docs/81-cockpit-realtime-projection-contract.md","source_type":"contract","authority":"CANONICAL","repository":"KayzenRoot/hive-plan","path":"docs/81-cockpit-realtime-projection-contract.md","git_sha":"873240792f4185b8ca96c961d07ce4724fa4912a","fingerprint":"sha256:c7b5553a16e7729ab4937612315964037041b7cfaa6eaa9a6bc08c911b58aaf","critical":true},{"source_id":"docs/82-first-slice-implementation-readiness.md","source_type":"architecture","authority":"CANONICAL","repository":"KayzenRoot/hive-plan","path":"docs/82-first-slice-implementation-readiness.md","git_sha":"873240792f4185b8ca96c961d07ce4724fa4912a","fingerprint":"sha256:6666c86dc4cbc17894dd266c81119cd74c056bea499add25353a3c43b3b41589","critical":true},{"source_id":"docs/82a-cockpit-design-tokens-and-component-contract.md","source_type":"contract","authority":"CANONICAL","repository":"KayzenRoot/hive-plan","path":"docs/82a-cockpit-design-tokens-and-component-contract.md","git_sha":"873240792f4185b8ca96c961d07ce4724fa4912a","fingerprint":"sha256:d77ecb58a9a9956f47d972996bf4896a84bc92eceb5e7618c13680f6276416ff","critical":true},{"source_id":"docs/83-cockpit-contracts-and-api-surface.md","source_type":"contract","authority":"CANONICAL","repository":"KayzenRoot/hive-plan","path":"docs/83-cockpit-contracts-and-api-surface.md","git_sha":"873240792f4185b8ca96c961d07ce4724fa4912a","fingerprint":"sha256:ecd7b943f2d1f22fa0c3fcce60ff3dcc1e1c86db3f15fc1681a85c3ff7bf9dec","critical":true},{"source_id":"docs/84-first-slice-postgres-bootstrap.md","source_type":"architecture","authority":"CANONICAL","repository":"KayzenRoot/hive-plan","path":"docs/84-first-slice-postgres-bootstrap.md","git_sha":"873240792f4185b8ca96c961d07ce4724fa4912a","fingerprint":"sha256:42c4c70dec315f99b9878f7bdafa50f53d41b683b7a027cf6bba067f640fb4c1","critical":true},{"source_id":"docs/85-first-slice-agent-taskgraph.md","source_type":"contract","authority":"CANONICAL","repository":"KayzenRoot/hive-plan","path":"docs/85-first-slice-agent-taskgraph.md","git_sha":"873240792f4185b8ca96c961d07ce4724fa4912a","fingerprint":"sha256:7a569dd10376225b150d61f586197a89becc282a98fed41ab40e2fc4bf7361b0","critical":true},{"source_id":"docs/86-first-cockpit-work-order-candidate.md","source_type":"work_order","authority":"CANONICAL","repository":"KayzenRoot/hive-plan","path":"docs/86-first-cockpit-work-order-candidate.md","git_sha":"873240792f4185b8ca96c961d07ce4724fa4912a","fingerprint":"sha256:569446792ba31dc7db6bed015daab39d47b1333650d435c259f079399ff18b4e","critical":true},{"source_id":"docs/87-hp-plan-009-readiness-audit.md","source_type":"evidence","authority":"CANONICAL","repository":"KayzenRoot/hive-plan","path":"docs/87-hp-plan-009-readiness-audit.md","git_sha":"873240792f4185b8ca96c961d07ce4724fa4912a","fingerprint":"sha256:118332539670cb73ec6953df5311def320121678f628e938a7c36d614f608002","critical":true},{"source_id":"docs/88-hp-plan-009-freeze-summary.md","source_type":"decision","authority":"CANONICAL","repository":"KayzenRoot/hive-plan","path":"docs/88-hp-plan-009-freeze-summary.md","git_sha":"873240792f4185b8ca96c961d07ce4724fa4912a","fingerprint":"sha256:9a5a07a62b66491290e448e92c7a2d188fe0d5f335d8130043509a9e17a17eef","critical":true}],"context_root":"sha256:f06d19db471f87c906e2251bf8605d9205e030c4d946cb266d800109ddae6575","expires_at":null,"created_at":"2026-09-11T17:38:00Z","producer":{"kind":"hive-plan-agent","name":"Context Lock Compiler","version":"planning-v1"},"extensions":{"hive-plan.fingerprint_method":"sha256('git-blob-sha1:' + blob_sha1)","hive-plan.issue":21}}